{
  "schemaVersion": 2,
  "id": "addition-subtraction-within-20",
  "status": "published",
  "routing": {
    "slug": "addition-subtraction-within-20",
    "aliases": []
  },
  "publication": {
    "publishedAt": "2026-10-05",
    "updatedAt": "2026-10-05"
  },
  "title": "Addition & Subtraction Within 20",
  "description": "Practice addition, subtraction, fact families, missing numbers, and story problems with numbers within 20.",
  "learningFocus": [
    "Solve addition and subtraction problems within 20 using equations, fact families, and simple stories."
  ],
  "adultGuidance": "Ask your child to explain whether each problem joins or separates quantities before solving it. Encourage a drawing, number line, or known fact when an answer is not immediately clear.",
  "taxonomy": {
    "grade": "kindergarten",
    "subject": "math",
    "topic": "addition",
    "skills": [
      "addition-subtraction-within-20"
    ]
  },
  "keywords": [
    "addition within 20",
    "subtraction within 20",
    "fact families",
    "missing numbers",
    "math story problems"
  ],
  "pages": [
    {
      "label": "Addition Within 20"
    },
    {
      "label": "Subtraction Within 20"
    },
    {
      "label": "Fact Families Within 20"
    },
    {
      "label": "Missing Numbers Within 20"
    },
    {
      "label": "Addition or Subtraction?"
    }
  ],
  "assets": {
    "bundlePdf": "worksheets/kindergarten/math/addition-subtraction/addition-subtraction-within-20.pdf",
    "pagePdfDirectory": "worksheets/kindergarten/math/addition-subtraction/addition-subtraction-within-20",
    "previewDirectory": "thumbnails/kindergarten/math/addition-subtraction/addition-subtraction-within-20",
    "preview": {
      "width": 1224,
      "height": 1584,
      "dpi": 144,
      "format": "png"
    }
  },
  "seo": {
    "title": "Addition & Subtraction Within 20 Worksheets | Learning Made Simple",
    "description": "Five printable Kindergarten math activities for addition, subtraction, fact families, missing numbers, and story problems within 20."
  },
  "source": {
    "type": "approved-bundle",
    "publisherContract": "worksheet-generator/content/addition-subtraction-within-20.json",
    "generatorConfig": null
  },
  "ordering": {
    "catalog": 64,
    "withinTopic": 3
  },
  "legacy": {
    "previewHref": "resource-preview.html?resource=addition-subtraction-within-20",
    "backHref": "topic.html?grade=Kindergarten&subject=Math&topic=Addition%20%26%20Subtraction",
    "backLabel": "Back to Addition & Subtraction"
  }
}
