{
  "schemaVersion": 2,
  "id": "positional-words",
  "status": "published",
  "routing": {
    "slug": "positional-words",
    "aliases": []
  },
  "publication": {
    "publishedAt": "2026-09-18",
    "updatedAt": "2026-09-24"
  },
  "title": "Positional Words",
  "description": "Learn and practice words that tell where objects are.",
  "learningFocus": [
    "Understand and use words that describe where objects are located."
  ],
  "adultGuidance": "Use a small toy and another object to demonstrate each position word before beginning. Ask your child to describe where the worksheet object is using the target word in a sentence.",
  "taxonomy": {
    "grade": "preschool",
    "subject": "math",
    "topic": "shapes-and-spatial-skills",
    "skills": [
      "positional-words"
    ]
  },
  "keywords": [
    "above",
    "below",
    "in",
    "on",
    "under",
    "next to",
    "between",
    "spatial words"
  ],
  "pages": [
    {},
    {},
    {},
    {},
    {}
  ],
  "assets": {
    "bundlePdf": "worksheets/preschool/math/shapes/positional-words.pdf",
    "pagePdfDirectory": "worksheets/preschool/math/shapes/positional-words",
    "previewDirectory": "thumbnails/preschool/math/shapes/positional-words",
    "preview": {
      "width": 1224,
      "height": 1584,
      "dpi": 144,
      "format": "png"
    }
  },
  "seo": {
    "title": "Positional Words Worksheets for Preschool | Learning Made Simple",
    "description": "Printable preschool activities for learning spatial words such as above, below, in, on, under, next to, and between."
  },
  "source": {
    "type": "generated",
    "publisherContract": "worksheet-generator/content/positional-words.json",
    "generatorConfig": "worksheet-generator/content/positional-words.json"
  },
  "ordering": {
    "catalog": 38,
    "withinTopic": 3
  },
  "legacy": {
    "previewHref": "resource-preview.html?resource=positional-words",
    "backHref": "topic.html?grade=Preschool&subject=Math&topic=Shapes%20%26%20Spatial%20Skills",
    "backLabel": "Back to Shapes & Spatial Skills"
  }
}
