{
  "schemaVersion": 2,
  "id": "clap-the-syllables",
  "status": "published",
  "routing": {
    "slug": "clap-the-syllables",
    "aliases": []
  },
  "publication": {
    "publishedAt": "2026-09-22",
    "updatedAt": "2026-09-26"
  },
  "title": "Clap the Syllables",
  "description": "Clap and count word beats with colorful pictures.",
  "learningFocus": [
    "Hear, clap, and count the syllables in familiar pictured words."
  ],
  "adultGuidance": "Name each picture clearly, then clap once for each spoken word part without stretching the word. Repeat the word slowly if needed and count the claps together.",
  "taxonomy": {
    "grade": "preschool",
    "subject": "reading-language",
    "topic": "rhymes-and-word-beats",
    "skills": [
      "syllables"
    ]
  },
  "keywords": [
    "syllables",
    "clap",
    "word beats",
    "phonological awareness",
    "count syllables"
  ],
  "pages": [
    {},
    {},
    {},
    {},
    {}
  ],
  "assets": {
    "bundlePdf": "worksheets/preschool/reading/letters/clap-the-syllables.pdf",
    "pagePdfDirectory": "worksheets/preschool/reading/letters/clap-the-syllables",
    "previewDirectory": "thumbnails/preschool/reading/letters/clap-the-syllables",
    "preview": {
      "width": 1224,
      "height": 1584,
      "dpi": 144,
      "format": "png"
    }
  },
  "seo": {
    "title": "Clap the Syllables Worksheets | Learning Made Simple",
    "description": "Printable preschool syllable activities for clapping and counting the word beats in familiar picture names."
  },
  "source": {
    "type": "approved-bundle",
    "publisherContract": "worksheet-generator/content/clap-the-syllables.json",
    "generatorConfig": null
  },
  "ordering": {
    "catalog": 14,
    "withinTopic": 2
  },
  "legacy": {
    "previewHref": "resource-preview.html?resource=clap-the-syllables",
    "backHref": "topic.html?grade=Preschool&subject=Reading%20%26%20Language&topic=Rhymes%20%26%20Word%20Beats",
    "backLabel": "Back to Rhymes & Word Beats"
  }
}
